{
  "rubric_version": "pda-handoff-v2",
  "candidate_id": "candidate-101",
  "benchmark_id": "build-update-visibility",
  "notes": "v2 rescore of the externally sourced candidate, making abstraction-level failure explicit.",
  "hard_gates": {
    "passed": false,
    "violations": [
      "skipped_option_resolution_when_required",
      "premature_recomposition",
      "wrong_abstraction_level"
    ],
    "rationale": "The response surveys options and recommends a bundle, but never isolates the benchmark's governing fork and remains centered on generic diagnostics rather than build/update-state legibility."
  },
  "phase_scores": {
    "descent": {
      "ambiguity_localization": { "score": 1, "rationale": "It recognizes the freshness/caching problem, but only loosely localizes the product ambiguity." },
      "abstraction_level_fidelity": { "score": 0, "rationale": "The trace operates at the wrong abstraction level: generic app diagnostics and support tooling instead of the benchmark's build/update-state legibility problem." },
      "forced_vs_chosen_separation": { "score": 1, "rationale": "Pros/cons are discussed, but forced structure and contingent policy are not cleanly separated." },
      "question_discipline": { "score": 1, "rationale": "It explores several options, but broadens rather than localizes the live ambiguity." },
      "non_premature_descent": { "score": 1, "rationale": "There is some exploration, but it settles on a recommendation before clarifying the key product-state and placement questions." },
      "optioning_readiness_discipline": { "score": 0, "rationale": "Options are enumerated at mixed layers before a concrete choice point is isolated." }
    },
    "option_resolution": {
      "explicit_residual_policy": { "score": 0, "rationale": "The core choice between deploy time, build identity, and update availability never becomes explicit." },
      "option_quality": { "score": 1, "rationale": "Listed options are sensible generally, but mix diagnostics, prevention, and UI surfacing in one plane." },
      "default_quality": { "score": 1, "rationale": "The multi-layer recommendation is plausible generally, but not centered on this benchmark." },
      "resolution_sufficiency": { "score": 0, "rationale": "The recommendation leaves the decisive benchmark ambiguity unresolved." },
      "recursive_return_discipline": { "score": 0, "rationale": "The response does not return to a deeper descent after broad option exploration reveals placement and audience questions." }
    },
    "recomposition": {
      "implementation_readiness": { "score": 1, "rationale": "A worker could implement something from the handoff, but likely the wrong shape for this benchmark." },
      "abstraction_level_fidelity": { "score": 0, "rationale": "The final handoff remains at the level of generic diagnostics and settings/about instrumentation rather than the benchmark's intended product state legibility." },
      "structural_fidelity": { "score": 0, "rationale": "The final handoff does not preserve the distinction between current build identity, update availability, and deploy-time support metadata." },
      "canonicality": { "score": 1, "rationale": "The handoff is organized, but carries extra generic recommendations not canonically shaped to the benchmark." },
      "delegation_reliability": { "score": 1, "rationale": "Execution would be reliable in a generic app-support sense, but likely drift from the intended outcome." },
      "declared_irrelevancies_and_nongoals": { "score": 0, "rationale": "No explicit non-goals or declared irrelevancies are stated." }
    }
  },
  "totals": {
    "descent": 4,
    "option_resolution": 2,
    "recomposition": 3,
    "overall": 9,
    "phase_minimums_passed": false,
    "interpretation": "poor_candidate"
  },
  "human_review": {
    "performed": true,
    "summary": "v2 makes the main failure explicit: the response is competent, but at the wrong abstraction level for the benchmark.",
    "questions": {
      "removed_concealed_arbitrariness": { "answer": "no", "rationale": "It surfaces possibilities, but not the hidden arbitrariness that mattered for this benchmark." },
      "questions_necessary_and_well_timed": { "answer": "mixed", "rationale": "The closing clarification questions are reasonable, but they arrive after a bundled recommendation." },
      "final_handoff_canonical": { "answer": "no", "rationale": "The final handoff is organized but not reduced to the benchmark's core task shape." },
      "delegation_reliable": { "answer": "mixed", "rationale": "Reliable for a generic diagnostic feature, not for the intended benchmark outcome." },
      "preserved_pda_spirit": { "answer": "no", "rationale": "It explores options helpfully, but does not descend to the governing ambiguity before recomposition." }
    }
  }
}
