{
  "rubric_version": "pda-handoff-v2",
  "candidate_id": "candidate-301",
  "benchmark_id": "build-update-visibility",
  "notes": "First LM-backed DSPy/Kimi candidate. It localizes the benchmark's governing ambiguity correctly and recomposes into a coherent landing-view-only implementation handoff, with some remaining compression in option resolution and non-goal declaration.",
  "hard_gates": {
    "passed": true,
    "violations": [],
    "rationale": "No hard-gate violation observed. The run stays centered on build/update-state legibility, resolves the key product placement and prominence forks before recomposition, and does not jump straight to deploy-time diagnostics."
  },
  "phase_scores": {
    "descent": {
      "ambiguity_localization": { "score": 2, "rationale": "It correctly identifies the underlying problem as legibility of the currently running build and its relation to updates, not merely deploy-time display." },
      "abstraction_level_fidelity": { "score": 2, "rationale": "The trace remains at the right abstraction level throughout the descent, centered on product-state legibility rather than generic support diagnostics." },
      "forced_vs_chosen_separation": { "score": 2, "rationale": "It distinguishes the forced need for current-build and stale-state legibility from contingent UI placement and prominence choices." },
      "question_discipline": { "score": 2, "rationale": "The surfaced questions are targeted and sequential, with each one reducing a live ambiguity rather than broadening the space." },
      "non_premature_descent": { "score": 2, "rationale": "It does not rush into a widget or endpoint design before shaping the governing product question." },
      "optioning_readiness_discipline": { "score": 2, "rationale": "It only resolves options after isolating the active forks around scope, audience, and sufficient build/update information." }
    },
    "option_resolution": {
      "explicit_residual_policy": { "score": 2, "rationale": "The remaining choices around placement, prominence, and what counts as stale are made explicit and resolved." },
      "option_quality": { "score": 1, "rationale": "The options are decision-relevant, but some are resolved inline by analysis rather than being presented as a cleanly enumerated choice set." },
      "default_quality": { "score": 2, "rationale": "The defaults are strong and converge toward the intended landing-only, non-modal build legibility outcome." },
      "resolution_sufficiency": { "score": 2, "rationale": "By recomposition, the material product ambiguity is resolved well enough for implementation handoff." },
      "recursive_return_discipline": { "score": 1, "rationale": "The trace shows good staged descent, but not a strong explicit return from optioning back into a deeper descent cycle." }
    },
    "recomposition": {
      "implementation_readiness": { "score": 2, "rationale": "The final handoff is directly actionable and specifies scope, behavior, data needs, and validation checks." },
      "abstraction_level_fidelity": { "score": 2, "rationale": "The final handoff remains centered on build/update-state legibility and avoids collapsing back into generic diagnostics." },
      "structural_fidelity": { "score": 2, "rationale": "It preserves the core distinctions between current build, latest available build, and stale-state signaling." },
      "canonicality": { "score": 2, "rationale": "The handoff is compact and avoids major irrelevant flourish, while staying aligned to the benchmark's intended shape." },
      "delegation_reliability": { "score": 2, "rationale": "A competent worker-agent should execute this with relatively little semantic drift." },
      "declared_irrelevancies_and_nongoals": { "score": 1, "rationale": "Out-of-scope items are listed, but the handoff is lighter than the baseline in explicitly declaring irrelevancies and non-goals as closure artifacts." }
    }
  },
  "totals": {
    "descent": 12,
    "option_resolution": 8,
    "recomposition": 11,
    "overall": 31,
    "phase_minimums_passed": true,
    "interpretation": "strong_pda_handoff"
  },
  "human_review": {
    "performed": true,
    "summary": "This is the first external-style candidate in the lab that lands close to the benchmark's intended abstraction level and produces a genuinely usable handoff. It still compresses some option-resolution structure compared with the hand-authored baseline, but it is qualitatively stronger than the earlier external candidate.",
    "questions": {
      "removed_concealed_arbitrariness": { "answer": "mixed", "rationale": "It surfaces and resolves the main hidden forks, though some residual policy shaping is compressed into narrative analysis rather than explicit options." },
      "questions_necessary_and_well_timed": { "answer": "yes", "rationale": "The trace asks the right questions in the right order for this benchmark." },
      "final_handoff_canonical": { "answer": "mixed", "rationale": "The handoff is coherent and compact, though slightly less explicit than the baseline about non-goals and closure state." },
      "delegation_reliable": { "answer": "yes", "rationale": "A worker-agent should execute toward the intended outcome with limited semantic drift." },
      "preserved_pda_spirit": { "answer": "mixed", "rationale": "It meaningfully de-arbitrarizes the task, even if it does not expose every residual choice as explicitly as the baseline." }
    }
  }
}
